{
  "tsconfig": "tsconfig.json",
  "services": [
    { "name": "ingest", "entry": "src/ingest/main.ts" },
    { "name": "alerts", "entry": "src/alerts/main.ts", "user": "alerts-svc" }
  ],
  "streams": "from-code",
  "admin": { "user": "admin" },
  "output": { "format": "server", "file": "nats/auth.conf" }
}
